{
  "schema_version": "1.2",
  "session_id": "ses-fixture",
  "user_request": "fixture request",
  "created_at": "2025-01-01T00:00:00Z",
  "updated_at": "2025-01-01T00:00:00Z",
  "status": "completed",
  "shared_context": {
    "contributions": {},
    "pending_actions": [
      {
        "action": "invoke_skill",
        "skill": "qcloud-monitor-ops",
        "reason": "follow-up check"
      }
    ],
    "evidence_chain": {
      "schema_version": "1.2",
      "strategy": {
        "strategy_schema": "1.2",
        "mode": "standard",
        "execution_path": "dual_path",
        "decision_maker": "agent_session_v1",
        "llm_native_target": false,
        "llm_native_note": "note",
        "customer": "acme",
        "region": "ap-guangzhou",
        "user_request": "inspect redis",
        "topology_summary": {
          "redis": 1
        },
        "resources_analyzed": 1,
        "agent_rationale": "cost opt",
        "selected_analyzers": [
          "redis",
          "cdb"
        ],
        "skipped_analyzers": [
          {
            "service": "redis",
            "reason": "low risk, skip for cost"
          }
        ],
        "analysis_depth": {
          "vm": "normal"
        },
        "early_stop": false,
        "priority_chain": []
      },
      "plan": {
        "steps": []
      },
      "process": [],
      "results": {}
    }
  }
}
