{
  "schema_version": "1.2",
  "session_id": "ses-fixture",
  "user_request": "fixture request",
  "created_at": "2025-01-01T00:00:00Z",
  "updated_at": "2025-01-01T00:00:00Z",
  "status": "completed",
  "shared_context": {
    "contributions": {},
    "pending_actions": [
      {
        "action": "invoke_skill",
        "skill": "qcloud-monitor-ops",
        "reason": "follow-up check"
      }
    ]
  }
}
